{
  "schema_version": "1.0",
  "job_id": "character-run-loop",
  "character": {
    "reference": "examples/replace-with-character.png",
    "description": "Preserve the character identity, costume, proportions, and drawing style."
  },
  "motion": {
    "request": "A clean side-view running cycle with stable camera and full silhouette visible.",
    "continuity": "loop"
  },
  "delivery": {
    "frame_counts": [16, 32, 64],
    "size": 256,
    "quality": "strict",
    "gif": true
  },
  "provider": {
    "plugin": "minimax_h3"
  }
}
